[
  {
    "schema_version": 1,
    "id": "source:sql-construction",
    "title": "SQL assembled from expressions",
    "category": "input_data_flow",
    "cwe": "CWE-89",
    "preconditions": [
      "A supported source/configuration file exists"
    ],
    "required_fixtures": [],
    "supported_targets": [
      "source"
    ],
    "authorization": "workspace read only",
    "mode": "review",
    "expected_secure_behavior": "Bind values using the database driver's parameter API; allowlist dynamic identifiers.",
    "observation": "Python AST or bounded syntactic pattern",
    "verification": "Fresh source read; never confirm exploitability from a pattern",
    "cleanup": "No target resources created",
    "timeout_seconds": 60,
    "resource_budget": "10,000 files / 50 MB repository; 1 MB per file",
    "limitations": [
      "No whole-program input provenance or deployment proof"
    ]
  },
  {
    "schema_version": 1,
    "id": "source:shell-command",
    "title": "Shell command execution interface",
    "category": "command_execution",
    "cwe": "CWE-78",
    "preconditions": [
      "A supported source/configuration file exists"
    ],
    "required_fixtures": [],
    "supported_targets": [
      "source"
    ],
    "authorization": "workspace read only",
    "mode": "review",
    "expected_secure_behavior": "Use an argument array with shell=False and validate untrusted arguments.",
    "observation": "Python AST or bounded syntactic pattern",
    "verification": "Fresh source read; never confirm exploitability from a pattern",
    "cleanup": "No target resources created",
    "timeout_seconds": 60,
    "resource_budget": "10,000 files / 50 MB repository; 1 MB per file",
    "limitations": [
      "No whole-program input provenance or deployment proof"
    ]
  },
  {
    "schema_version": 1,
    "id": "source:unsafe-deserialization",
    "title": "Unsafe deserialization interface",
    "category": "input_data_flow",
    "cwe": "CWE-502",
    "preconditions": [
      "A supported source/configuration file exists"
    ],
    "required_fixtures": [],
    "supported_targets": [
      "source"
    ],
    "authorization": "workspace read only",
    "mode": "review",
    "expected_secure_behavior": "Accept a schema-validated data format instead of deserializing executable objects.",
    "observation": "Python AST or bounded syntactic pattern",
    "verification": "Fresh source read; never confirm exploitability from a pattern",
    "cleanup": "No target resources created",
    "timeout_seconds": 60,
    "resource_budget": "10,000 files / 50 MB repository; 1 MB per file",
    "limitations": [
      "No whole-program input provenance or deployment proof"
    ]
  },
  {
    "schema_version": 1,
    "id": "source:dynamic-eval",
    "title": "Dynamic code evaluation",
    "category": "input_data_flow",
    "cwe": "CWE-95",
    "preconditions": [
      "A supported source/configuration file exists"
    ],
    "required_fixtures": [],
    "supported_targets": [
      "source"
    ],
    "authorization": "workspace read only",
    "mode": "review",
    "expected_secure_behavior": "Replace evaluation with a bounded parser or explicit operation mapping.",
    "observation": "Python AST or bounded syntactic pattern",
    "verification": "Fresh source read; never confirm exploitability from a pattern",
    "cleanup": "No target resources created",
    "timeout_seconds": 60,
    "resource_budget": "10,000 files / 50 MB repository; 1 MB per file",
    "limitations": [
      "No whole-program input provenance or deployment proof"
    ]
  },
  {
    "schema_version": 1,
    "id": "source:jwt-no-verify",
    "title": "Token signature verification disabled",
    "category": "authentication",
    "cwe": "CWE-347",
    "preconditions": [
      "A supported source/configuration file exists"
    ],
    "required_fixtures": [],
    "supported_targets": [
      "source"
    ],
    "authorization": "workspace read only",
    "mode": "review",
    "expected_secure_behavior": "Require signature, issuer, audience and expiry validation for the intended token type.",
    "observation": "Python AST or bounded syntactic pattern",
    "verification": "Fresh source read; never confirm exploitability from a pattern",
    "cleanup": "No target resources created",
    "timeout_seconds": 60,
    "resource_budget": "10,000 files / 50 MB repository; 1 MB per file",
    "limitations": [
      "No whole-program input provenance or deployment proof"
    ]
  },
  {
    "schema_version": 1,
    "id": "source:weak-crypto",
    "title": "Legacy digest in security-sensitive code",
    "category": "cryptography",
    "cwe": "CWE-327",
    "preconditions": [
      "A supported source/configuration file exists"
    ],
    "required_fixtures": [],
    "supported_targets": [
      "source"
    ],
    "authorization": "workspace read only",
    "mode": "review",
    "expected_secure_behavior": "Use a current purpose-specific primitive; password storage requires a password KDF.",
    "observation": "Python AST or bounded syntactic pattern",
    "verification": "Fresh source read; never confirm exploitability from a pattern",
    "cleanup": "No target resources created",
    "timeout_seconds": 60,
    "resource_budget": "10,000 files / 50 MB repository; 1 MB per file",
    "limitations": [
      "No whole-program input provenance or deployment proof"
    ]
  },
  {
    "schema_version": 1,
    "id": "source:debug-mode",
    "title": "Debug configuration enabled",
    "category": "configuration",
    "cwe": "CWE-489",
    "preconditions": [
      "A supported source/configuration file exists"
    ],
    "required_fixtures": [],
    "supported_targets": [
      "source"
    ],
    "authorization": "workspace read only",
    "mode": "review",
    "expected_secure_behavior": "Disable debug mode outside disposable development environments.",
    "observation": "Python AST or bounded syntactic pattern",
    "verification": "Fresh source read; never confirm exploitability from a pattern",
    "cleanup": "No target resources created",
    "timeout_seconds": 60,
    "resource_budget": "10,000 files / 50 MB repository; 1 MB per file",
    "limitations": [
      "No whole-program input provenance or deployment proof"
    ]
  },
  {
    "schema_version": 1,
    "id": "source:unsafe-html",
    "title": "Direct HTML rendering sink",
    "category": "frontend",
    "cwe": "CWE-79",
    "preconditions": [
      "A supported source/configuration file exists"
    ],
    "required_fixtures": [],
    "supported_targets": [
      "source"
    ],
    "authorization": "workspace read only",
    "mode": "review",
    "expected_secure_behavior": "Render text or sanitize untrusted HTML using a maintained, configured sanitizer.",
    "observation": "Python AST or bounded syntactic pattern",
    "verification": "Fresh source read; never confirm exploitability from a pattern",
    "cleanup": "No target resources created",
    "timeout_seconds": 60,
    "resource_budget": "10,000 files / 50 MB repository; 1 MB per file",
    "limitations": [
      "No whole-program input provenance or deployment proof"
    ]
  },
  {
    "schema_version": 1,
    "id": "source:potential-secret",
    "title": "Potential embedded credential",
    "category": "sensitive_data",
    "cwe": "CWE-798",
    "preconditions": [
      "A supported source/configuration file exists"
    ],
    "required_fixtures": [],
    "supported_targets": [
      "source"
    ],
    "authorization": "workspace read only",
    "mode": "review",
    "expected_secure_behavior": "Remove and rotate the credential if genuine; use an external secret store.",
    "observation": "Python AST or bounded syntactic pattern",
    "verification": "Fresh source read; never confirm exploitability from a pattern",
    "cleanup": "No target resources created",
    "timeout_seconds": 60,
    "resource_budget": "10,000 files / 50 MB repository; 1 MB per file",
    "limitations": [
      "No whole-program input provenance or deployment proof"
    ]
  },
  {
    "schema_version": 1,
    "id": "source:sensitive-logging",
    "title": "Potential sensitive value logged",
    "category": "sensitive_logging",
    "cwe": "CWE-532",
    "preconditions": [
      "A supported source/configuration file exists"
    ],
    "required_fixtures": [],
    "supported_targets": [
      "source"
    ],
    "authorization": "workspace read only",
    "mode": "review",
    "expected_secure_behavior": "Remove sensitive fields from log events and apply structured redaction.",
    "observation": "Python AST or bounded syntactic pattern",
    "verification": "Fresh source read; never confirm exploitability from a pattern",
    "cleanup": "No target resources created",
    "timeout_seconds": 60,
    "resource_budget": "10,000 files / 50 MB repository; 1 MB per file",
    "limitations": [
      "No whole-program input provenance or deployment proof"
    ]
  },
  {
    "schema_version": 1,
    "id": "source:cors-wildcard",
    "title": "Wildcard CORS configuration",
    "category": "cors",
    "cwe": "CWE-942",
    "preconditions": [
      "A supported source/configuration file exists"
    ],
    "required_fixtures": [],
    "supported_targets": [
      "source"
    ],
    "authorization": "workspace read only",
    "mode": "review",
    "expected_secure_behavior": "Restrict origins where cross-origin access is not intended; verify credential behavior.",
    "observation": "Python AST or bounded syntactic pattern",
    "verification": "Fresh source read; never confirm exploitability from a pattern",
    "cleanup": "No target resources created",
    "timeout_seconds": 60,
    "resource_budget": "10,000 files / 50 MB repository; 1 MB per file",
    "limitations": [
      "No whole-program input provenance or deployment proof"
    ]
  },
  {
    "schema_version": 1,
    "id": "source:csrf-disabled",
    "title": "CSRF control explicitly disabled",
    "category": "csrf",